show databases;
+--------------------+
| Database           |
+--------------------+
| information_schema |
| emp                |
| mysql              |
| performance_schema |
| student            |
| test               |
+--------------------+
6 rows in set (0.14 sec)

mysql> use emp;
Database changed
mysql> create table product (id integer,pname varchar,quantity integer);
ERROR 1064 (42000): You have an error in your SQL syntax; check the manual that corresponds to your MySQL server version for the right syntax to use near 'quantity integer)' at line 1
mysql> create table product(pid int,pname varchar(120),quantity int);
Query OK, 0 rows affected (0.47 sec)

mysql> desc product;
+----------+--------------+------+-----+---------+-------+
| Field    | Type         | Null | Key | Default | Extra |
+----------+--------------+------+-----+---------+-------+
| pid      | int(11)      | YES  |     | NULL    |       |
| pname    | varchar(120) | YES  |     | NULL    |       |
| quantity | int(11)      | YES  |     | NULL    |       |
+----------+--------------+------+-----+---------+-------+
3 rows in set (0.16 sec)
 drop database emp;
Query OK, 1 row affected (0.25 sec)

mysql> show databases;
+--------------------+
| Database           |
+--------------------+
| information_schema |
| mysql              |
| performance_schema |
| student            |
| test               |
+--------------------+
5 rows in set (0.00 sec)
show databases;
+--------------------+
| Database           |
+--------------------+
| information_schema |
| mysql              |
| performance_schema |
| student            |
| test               |
| ust_db             |
+--------------------+
6 rows in set (0.00 sec)

mysql> use ust_db;
Database changed
mysql> create table product(pid int,pname varchar,quantity int);
ERROR 1064 (42000): You have an error in your SQL syntax; check the manual that corresponds to your MySQL server version for the right syntax to use near 'quantity int)' at line 1
mysql> create table product(pid int,pname varchar(120),quantity int);
Query OK, 0 rows affected (0.08 sec)

mysql> alter table product add column price int;
Query OK, 0 rows affected (0.27 sec)
Records: 0  Duplicates: 0  Warnings: 0

mysql> desc product;
+----------+--------------+------+-----+---------+-------+
| Field    | Type         | Null | Key | Default | Extra |
+----------+--------------+------+-----+---------+-------+
| pid      | int(11)      | YES  |     | NULL    |       |
| pname    | varchar(120) | YES  |     | NULL    |       |
| quantity | int(11)      | YES  |     | NULL    |       |
| price    | int(11)      | YES  |     | NULL    |       |
+----------+--------------+------+-----+---------+-------+
4 rows in set (0.00 sec)
 alter table product change column price cost int;//used to change the column name
Query OK, 0 rows affected (0.36 sec)
Records: 0  Duplicates: 0  Warnings: 0
 desc product;
+----------+--------------+------+-----+---------+-------+
| Field    | Type         | Null | Key | Default | Extra |
+----------+--------------+------+-----+---------+-------+
| pid      | int(11)      | YES  |     | NULL    |       |
| pname    | varchar(120) | YES  |     | NULL    |       |
| quantity | int(11)      | YES  |     | NULL    |       |
| cost     | int(11)      | YES  |     | NULL    |       |
+----------+--------------+------+-----+---------+-------+
4 rows in set (0.00 sec)
mysql> alter table product drop column cost;//used to drop the column
Query OK, 0 rows affected (0.25 sec)
Records: 0  Duplicates: 0  Warnings: 0
mysql> rename table product to product_info;//used to rename the table name
Query OK, 0 rows affected (0.09 sec)
mysql> show tables;//used to show the tables
+------------------+
| Tables_in_ust_db |
+------------------+
| product_info     |
+------------------+
1 row in set (0.00 sec)
mysql> rename databse ust_db to ust_dab;//we cant rename the database name by using rename command
ERROR 1064 (42000): You have an error in your SQL syntax; check the manual that corresponds to your MySQL server version for the right syntax to use near 'databse ust_db to ust_dab' at line 1
DATA MANIPULATION LANGUAGE:
Its dealing with the data.
1.INSERT
2.DELETE
3.UPDATE
/*********************INSERT*********************/
mysql>  insert into product_info(pid,pname,quantity)values(1,'pencil',10);
Query OK, 1 row affected (0.05 sec)
mysql> select *
    -> from product_info;//used to check the data fro the table
+------+--------+----------+
| pid  | pname  | quantity |
+------+--------+----------+
|    1 | pencil |       10 |
+------+--------+----------+
1 row in set (0.00 sec)
mysql> insert into product_info values(2,'pen',20);//it can also be used for inserting the data
Query OK, 1 row affected (0.14 sec)
mysql> insert into product_info(pid,pname)values(3,'paper');//if we want to insert the data into a perticular column we have to use this command//
Query OK, 1 row affected (0.13 sec)

mysql> select *
    -> from product_info;
+------+--------+----------+
| pid  | pname  | quantity |
+------+--------+----------+
|    1 | pencil |       10 |
|    2 | pen    |       20 |
|    3 | paper  |     NULL |
+------+--------+----------+
mysql> insert into product_info(pid,pname,quantity) values(4,'laptop',102),(5,'mouse',200),(6,'watch',500);//used to insert the more data into a table at a time//
Query OK, 3 rows affected (0.19 sec)
Records: 3  Duplicates: 0  Warnings: 0

mysql> select * from product_info;
+------+--------+----------+
| pid  | pname  | quantity |
+------+--------+----------+
|    1 | pencil |       10 |
|    2 | pen    |       20 |
|    3 | paper  |     NULL |
|    4 | laptop |      102 |
|    5 | mouse  |      200 |
|    6 | watch  |      500 |
+------+--------+----------+
6 rows in set (0.00 sec)

3 rows in set (0.00 sec)
/************************UPDATE**************************/
mysql> update product_info set quantity=100;//used to update the column
Query OK, 6 rows affected (0.06 sec)
Rows matched: 6  Changed: 6  Warnings: 0
s
mysql> select * from product_info;
+------+--------+----------+
| pid  | pname  | quantity |
+------+--------+----------+
|    1 | pencil |      100 |
|    2 | pen    |      100 |
|    3 | paper  |      100 |
|    4 | laptop |      100 |
|    5 | mouse  |      100 |
|    6 | watch  |      100 |
+------+--------+----------+
6 rows in set (0.00 sec)
/******************DELETE***********************/
mysql> delete from product_info;//It will delete the entire data from the table
Query OK, 6 rows affected (0.07 sec)

mysql> select * from product_info;
Empty set (0.00 sec)
3.DATA QUERY LANGUAGE
1.SELECT:It is the only one command present in DQL
-->With the help of 'select' statement we can retrieve the data in three ways
1.projection
2.selection
3.joins
1.PROJECTION:If we want all the data from a perticular column we will go for projection.
EX : mysql> select pname from product_info;
+--------+
| pname  |
+--------+
| pen    |
| pencil |
| paper  |
+--------+
3 rows in set (0.00 sec)
2.SELECTION: It will select rows and columns from the table.
EX: mysql> select * from product_info;
+------+--------+----------+
| pid  | pname  | quantity |
+------+--------+----------+
|    1 | pen    |        2 |
|    2 | pencil |        1 |
|    3 | paper  |        5 |
+------+--------+----------+
3 rows in set (0.02 sec)
mysql> create table employee(eid int,name varchar(250) not null,mobileno int unique,dob varchar(200),gender varchar(30),primary key(eid));//creation of new table by using constraints and primary key//
Query OK, 0 rows affected (0.16 sec)
/****************TRUNCATE***************/
mysql> truncate product_info;//used to delete the data permanently//
Query OK, 0 rows affected (0.11 sec)

mysql> show databases;
+--------------------+
| Database           |
+--------------------+
| information_schema |
| mysql              |
| performance_schema |
| student            |
| test               |
| ust_db             |
+--------------------+
6 rows in set (0.03 sec)
/*********************DISTINCT*****************/
Distinct: It is used to give the unique values.
mysql> select distinct name from employee;
+----------+
| name     |
+----------+
| deepthi  |
| bindu    |
| sirisha  |
| prathysa |
| mallika  |
+----------+
5 rows in set (0.00 sec)

mysql> select distinct name,designation from employee;
+----------+-------------+
| name     | designation |
+----------+-------------+
| deepthi  | software    |
| bindu    | analyst     |
| sirisha  | hr          |
| prathysa | tester      |
| mallika  | tester      |
+----------+-------------+
5 rows in set (0.00 sec)
/****************ALIAS**********************/
Alias: temparary name to the table and column names.
--->If we want to use ALIAS use the keyword 'AS'.
Syntax: select column_name as alias_name from table;
mysql> select designation as dg from employee;
EX:
+----------+
| dg       |
+----------+
| software |
| analyst  |
| hr       |
| tester   |
| tester   |
| tester   |
+----------+
6 rows in set (0.05 sec)
EX2:
mysql> select designation dg1 from employee;//we can use like this also.
+----------+
| dg1      |
+----------+
| software |
| analyst  |
| hr       |
| tester   |
| tester   |
| tester   |
+----------+
6 rows in set (0.00 sec)
/*********************WHERE*********************/
WHERE: the 'where' clause is used to filter the record.
--->'where' command is used with 'update','delete','select'.
mysql> update employee set designation='manager' where eid=6;
Query OK, 1 row affected (0.14 sec)
Rows matched: 1  Changed: 1  Warnings: 0

mysql> select * from employee;
+-----+----------+----------+------------+--------+-------------+--------+------+------------+--------+
| eid | name     | mobileno | dofb       | gender | designation | deptno | age  | doj        | salary |
+-----+----------+----------+------------+--------+-------------+--------+------+------------+--------+
|   2 | deepthi  |   965273 | 1999-10-19 | female | software    |     23 |   21 | 2019-03-12 |   2000 |
|   3 | bindu    |  9643245 | 1999-10-09 | female | analyst     |     34 |   22 | 2019-03-12 |   2010 |
|   4 | sirisha  |  5678953 | 1989-07-09 | female | hr          |     44 |   23 | 2019-03-22 |   2410 |
|   5 | prathysa |  9832456 | 2000-07-09 | female | tester      |     55 |   23 | 2019-03-22 |   2410 |
|   6 | mallika  |  9845324 | 2000-08-09 | female | manager     |     55 |   23 | 2019-03-22 |   2410 |
|   7 | mallika  |  9845334 | 2100-08-09 | female | tester      |     55 |   23 | 2019-03-22 |   2410 |
+-----+----------+----------+------------+--------+-------------+--------+------+------------+--------+
6 rows in set (0.00 sec)
mysql> delete from employee where eid=4;//by using delete command we deleted perticular row.
Query OK, 1 row affected (0.08 sec)

mysql> select * from employee;
+-----+----------+----------+------------+--------+-------------+--------+------+------------+--------+
| eid | name     | mobileno | dofb       | gender | designation | deptno | age  | doj        | salary |
+-----+----------+----------+------------+--------+-------------+--------+------+------------+--------+
|   2 | deepthi  |   965273 | 1999-10-19 | female | software    |     23 |   21 | 2019-03-12 |   2000 |
|   3 | bindu    |  9643245 | 1999-10-09 | female | analyst     |     34 |   22 | 2019-03-12 |   2010 |
|   5 | prathysa |  9832456 | 2000-07-09 | female | tester      |     55 |   23 | 2019-03-22 |   2410 |
|   6 | mallika  |  9845324 | 2000-08-09 | female | manager     |     55 |   23 | 2019-03-22 |   2410 |
|   7 | mallika  |  9845334 | 2100-08-09 | female | tester      |     55 |   23 | 2019-03-22 |   2410 |
+-----+----------+----------+------------+--------+-------------+--------+------+------------+--------+
5 rows in set (0.00 sec)
mysql> select * from employee where eid=2;
+-----+---------+----------+------------+--------+-------------+--------+------+------------+--------+
| eid | name    | mobileno | dofb       | gender | designation | deptno | age  | doj        | salary |
+-----+---------+----------+------------+--------+-------------+--------+------+------------+--------+
|   2 | deepthi |   965273 | 1999-10-19 | female | software    |     23 |   21 | 2019-03-12 |   2000 |
+-----+---------+----------+------------+--------+-------------+--------+------+------------+--------+
1 row in set (0.00 sec)
/*****************OPERATORS**********************/
Operators:
1.Arithematic
2.Logical
3.Relational
4.Special
/***************ARITHEMATIC**********************/
Arithemetic: +,-,*,%,/
query1.waqtd salary of emp that is incremented by 5000.
mysql> select salary+5000 increment from employee;
+-----------+
| increment |
+-----------+
|      7000 |
|      7010 |
|      7410 |
|      7410 |
|      7410 |
+-----------+
5 rows in set (0.00 sec)
2.waqtd salary of emp that is decremented by 5000.
mysql> select salary-5000 decrement from employee;
+-----------+
| decrement |
+-----------+
|     -3000 |
|     -2990 |
|     -2590 |
|     -2590 |
|     -2590 |
+-----------+
5 rows in set (0.02 sec)
3.waqtd the anual salary.
mysql> select salary*12 anualsal from employee;
+----------+
| anualsal |
+----------+
|    24000 |
|    24120 |
|    28920 |
|    28920 |
|    28920 |
+----------+
4.waqtd the day salary
mysql> select salary/30 from employee;
+-----------+
| salary/30 |
+-----------+
|   66.6667 |
|   67.0000 |
|   80.3333 |
|   80.3333 |
|   80.3333 |
+-----------+
/********************Relational****************/
Relational:=,!= or <>,>,<,>=,<=
1.waqtd the result from the emp designation is software developer
mysql> select designation from employee where designation='software';
+-------------+
| designation |
+-------------+
| software    |
+-------------+
2.waqtd all the record of the employee excluding who is working in department 23.
mysql> select * from employee where deptno<>23;
+-----+----------+----------+------------+--------+-------------+--------+------+------------+--------+
| eid | name     | mobileno | dofb       | gender | designation | deptno | age  | doj        | salary |
+-----+----------+----------+------------+--------+-------------+--------+------+------------+--------+
|   3 | bindu    |  9643245 | 1999-10-09 | female | analyst     |     34 |   22 | 2019-03-12 |   2010 |
|   5 | prathysa |  9832456 | 2000-07-09 | female | tester      |     55 |   23 | 2019-03-22 |   2410 |
|   6 | mallika  |  9845324 | 2000-08-09 | female | manager     |     55 |   23 | 2019-03-22 |   2410 |
|   7 | mallika  |  9845334 | 2100-08-09 | female | tester      |     55 |   23 | 2019-03-22 |   2410 |
+-----+----------+----------+------------+--------+-------------+--------+------+------------+--------+
4 rows in set (0.05 sec)
3.waqtd the record of employee whos salary is 24005.
mysql> select * from employee where salary>2400;
+-----+----------+----------+------------+--------+-------------+--------+------+------------+--------+
| eid | name     | mobileno | dofb       | gender | designation | deptno | age  | doj        | salary |
+-----+----------+----------+------------+--------+-------------+--------+------+------------+--------+
|   5 | prathysa |  9832456 | 2000-07-09 | female | tester      |     55 |   23 | 2019-03-22 |   2410 |
|   6 | mallika  |  9845324 | 2000-08-09 | female | manager     |     55 |   23 | 2019-03-22 |   2410 |
|   7 | mallika  |  9845334 | 2100-08-09 | female | tester      |     55 |   23 | 2019-03-22 |   2410 |
+-----+----------+----------+------------+--------+-------------+--------+------+------------+--------+
3 rows in set (0.00 sec)
4.waqtd the records of employee whose age is less than 22.

mysql> select * from employee where age>22;
+-----+----------+----------+------------+--------+-------------+--------+------+------------+--------+
| eid | name     | mobileno | dofb       | gender | designation | deptno | age  | doj        | salary |
+-----+----------+----------+------------+--------+-------------+--------+------+------------+--------+
|   5 | prathysa |  9832456 | 2000-07-09 | female | tester      |     55 |   23 | 2019-03-22 |   2410 |
|   6 | mallika  |  9845324 | 2000-08-09 | female | manager     |     55 |   23 | 2019-03-22 |   2410 |
|   7 | mallika  |  9845334 | 2100-08-09 | female | tester      |     55 |   23 | 2019-03-22 |   2410 |
+-----+----------+----------+------------+--------+-------------+--------+------+------------+--------+
3 rows in set (0.00 sec)

5.watd name,sal,mobileno whose age is greater than or equal to 22.

mysql> select name,mobileno,age from employee where age>=22;
+----------+----------+------+
| name     | mobileno | age  |
+----------+----------+------+
| bindu    |  9643245 |   22 |
| prathysa |  9832456 |   23 |
| mallika  |  9845324 |   23 |
| mallika  |  9845334 |   23 |
+----------+----------+------+
6.waqtd all the records whose salary is lessthan or equal to 2400 .
mysql> select * from employee where salary<=2400;
+-----+---------+----------+------------+--------+-------------+--------+------+------------+--------+
| eid | name    | mobileno | dofb       | gender | designation | deptno | age  | doj        | salary |
+-----+---------+----------+------------+--------+-------------+--------+------+------------+--------+
|   2 | deepthi |   965273 | 1999-10-19 | female | software    |     23 |   21 | 2019-03-12 |   2000 |
|   3 | bindu   |  9643245 | 1999-10-09 | female | analyst     |     34 |   22 | 2019-03-12 |   2010 |
+-----+---------+----------+------------+--------+-------------+--------+------+------------+--------+
2 rows in set (0.00 sec)
/********************LOGICAL OPERATOR**********************/
Logical Operator:AND,OR,NOT
AND:
syntax: select * from table_name where condition and condition.
OR:
syntax: select * from table_name where condition or condition.
NOT:
syntax: select * from table_name where not condition
1.waqtd 